{
    "$schema": "../army.schema.json",
    "title": "Iron Jaws",
    "icon": "iron-jaws.png",
    "color": "#315442",
    "grandFaction": "Destruction",
    "warscrolls": [
        {
            "name": "Wierdnob Shaman",
            "faction": "Iron Jaws",
            "stats": {
                "movement": "4\"",
                "save": "6+",
                "control": "2",
                "health": "6"
            },
            "rangedWeapons": [
                {
                    "name": "Green Puke",
                    "rng": "10\"",
                    "atk": "4",
                    "hit": "2+",
                    "wnd": "4+",
                    "rnd": "-",
                    "dmg": "D3",
                    "abilities": [
                        "Shoot in Combat"
                    ]
                }
            ],
            "meleeWeapons": [
                {
                    "name": "Waaagh! Staff",
                    "atk": "3",
                    "hit": "4+",
                    "wnd": "3+",
                    "rnd": "1",
                    "dmg": "D3"
                }
            ],
            "abilities": [
                {
                    "name": "Brutal Power",
                    "header": {
                        "icon": "special",
                        "color": "yellow",
                        "text": "Passive"
                    },
                    "effect": "Add 1 to this unit's power level while there are any friendly **IRONJAWZ** units that have 10 or more models wholly within 12\" of it."
                }
            ],
            "primaryKeywords": [
                "Hero",
                "Wizard(1)",
                "Infantry"
            ],
            "secondaryKeywords": [
                "Destruction",
                "IronJaws"
            ]
        }
    ]
}